{
    "code": "NEG-network-offline",
    "category": "network",
    "httpStatus": null,
    "severity": "warning",
    "title": "No Internet Connection",
    "description": "Your device appears to be offline.",
    "messageKey": "network.offline",
    "recoveryAction": "Connect to the internet and refresh.",
    "platforms": [
        "web",
        "mobile",
        "tablet"
    ],
    "accessibility": {
        "ariaRole": "alert",
        "ariaLive": "assertive"
    }
}
